{
  "description": "sample Github_easy/o57048.json",
  "meta": {
    "full_size": 300,
    "stripped_size": 300,
    "features": [
      "additionalProperties",
      "items"
    ],
    "raw_features": [
      "$schema",
      "_boolSchema",
      "properties",
      "required",
      "type",
      "type:array",
      "type:object",
      "type:string"
    ]
  },
  "schema": {
    "$schema": "http://json-schema.org/draft-04/schema#",
    "additionalProperties": false,
    "properties": {
      "customer": {
        "type": "string"
      },
      "message": {
        "type": "string"
      },
      "recipients": {
        "items": {
          "type": "string"
        },
        "type": "array"
      },
      "sender": {
        "type": "string"
      }
    },
    "required": [
      "customer",
      "message",
      "recipients"
    ],
    "type": "object"
  },
  "tests": [
    {
      "description": "llama 70b generated valid",
      "valid": true,
      "data": {
        "customer": "John Doe",
        "message": "Hello, this is a test message.",
        "recipients": [
          "jane.doe@example.com",
          "bob.smith@example.com"
        ],
        "sender": "john.doe@example.com"
      }
    },
    {
      "description": "llama-70b generated negative",
      "valid": false,
      "rust_error": "12345 is not of type \"string\"",
      "python_error": "Additional properties are not allowed ('extraProperty' was unexpected)\n\nFailed validating 'additionalProperties' in schema:\n    {'$schema': 'http://json-schema.org/draft-04/schema#',\n     'additionalProperties': False,\n     'properties': {'customer': {'type': 'string'},\n                    'message': {'type': 'string'},\n                    'recipients': {'items': {'type': 'string'},\n                                   'type': 'array'},\n                    'sender': {'type': 'string'}},\n     'required': ['customer', 'message', 'recipients'],\n     'type': 'object'}\n\nOn instance:\n    {'customer': 'John Doe',\n     'message': 'Hello, this is a test message.',\n     'recipients': ['jane.doe@example.com', 12345],\n     'sender': 'john.doe@example.com',\n     'extraProperty': 'extraValue'}",
      "data": {
        "customer": "John Doe",
        "message": "Hello, this is a test message.",
        "recipients": [
          "jane.doe@example.com",
          12345
        ],
        "sender": "john.doe@example.com",
        "extraProperty": "extraValue"
      }
    },
    {
      "description": "llama 70b generated positive",
      "valid": true,
      "data": {
        "customer": "John Doe",
        "message": "Hello, this is a test message.",
        "recipients": [
          "jane.doe@example.com",
          "john.smith@example.com"
        ],
        "sender": "john.doe@example.com"
      }
    }
  ]
}