{
  "description": "sample Github_easy/o62759.json",
  "meta": {
    "full_size": 436,
    "stripped_size": 351,
    "features": [
      "dependencies",
      "enum"
    ],
    "raw_features": [
      "$schema",
      "properties",
      "required",
      "type",
      "type:object"
    ]
  },
  "schema": {
    "$schema": "http://json-schema.org/draft-04/schema#",
    "title": "ico",
    "description": "An ico atom",
    "type": "object",
    "properties": {
      "icon": {
        "description": "The short name of the icon",
        "enum": [
          "arrow-right",
          "chevron-up",
          "close",
          "exit-search",
          "expert-tool-user",
          "flag-ch",
          "flag-de",
          "flag-fr",
          "heading",
          "icon-info",
          "icon-info-circle",
          "icon-remove-tag",
          "lightbox-close",
          "lightbox-open",
          "nitro",
          "nitro-full"
        ]
      }
    },
    "required": [
      "icon"
    ],
    "dependencies": {}
  },
  "tests": [
    {
      "description": "llama 70b generated positive",
      "valid": true,
      "data": {
        "icon": "arrow-right"
      }
    },
    {
      "description": "llama-70b generated negative",
      "valid": false,
      "rust_error": "\"arrow-left\" is not one of [\"arrow-right\",\"chevron-up\",\"close\",\"exit-search\",\"expert-tool-user\",\"flag-ch\",\"flag-de\",\"flag-fr\",\"heading\",\"icon-info\",\"icon-info-circle\",\"icon-remove-tag\",\"lightbox-close\",\"lightbox-open\",\"nitro\",\"nitro-full\"]",
      "python_error": "'arrow-left' is not one of ['arrow-right', 'chevron-up', 'close', 'exit-search', 'expert-tool-user', 'flag-ch', 'flag-de', 'flag-fr', 'heading', 'icon-info', 'icon-info-circle', 'icon-remove-tag', 'lightbox-close', 'lightbox-open', 'nitro', 'nitro-full']\n\nFailed validating 'enum' in schema['properties']['icon']:\n    {'description': 'The short name of the icon',\n     'enum': ['arrow-right',\n              'chevron-up',\n              'close',\n              'exit-search',\n              'expert-tool-user',\n              'flag-ch',\n              'flag-de',\n              'flag-fr',\n              'heading',\n              'icon-info',\n              'icon-info-circle',\n              'icon-remove-tag',\n              'lightbox-close',\n              'lightbox-open',\n              'nitro',\n              'nitro-full']}\n\nOn instance['icon']:\n    'arrow-left'",
      "data": {
        "icon": "arrow-left"
      }
    }
  ]
}