{
  "description": "sample Github_easy/o90373.json",
  "meta": {
    "full_size": 456,
    "stripped_size": 243,
    "features": [
      "additionalProperties",
      "enum"
    ],
    "raw_features": [
      "$schema",
      "_boolSchema",
      "id",
      "properties",
      "required",
      "type",
      "type:object",
      "type:string"
    ]
  },
  "schema": {
    "$schema": "http://json-schema.org/draft-04/schema#",
    "id": "http://judkins.house/apis/k2/v1/canalFabricNetworkVxlan.json",
    "$$target": "canalFabricNetworkVxlan.json",
    "title": "Canal Fabric VXLan Network configuration",
    "description": "Canal Fabric VXLan Network configuration.",
    "properties": {
      "type": {
        "description": "Indicates that it is vxlan.",
        "enum": [
          "vxlan"
        ],
        "type": "string",
        "default": "vxlan"
      }
    },
    "required": [
      "type"
    ],
    "additionalProperties": false,
    "type": "object"
  },
  "tests": [
    {
      "description": "llama 70b generated valid",
      "valid": true,
      "data": {
        "type": "vxlan"
      }
    },
    {
      "description": "llama-70b generated negative",
      "valid": false,
      "rust_error": "\"vlan\" is not one of [\"vxlan\"]",
      "python_error": "'vlan' is not one of ['vxlan']\n\nFailed validating 'enum' in schema['properties']['type']:\n    {'description': 'Indicates that it is vxlan.',\n     'enum': ['vxlan'],\n     'type': 'string',\n     'default': 'vxlan'}\n\nOn instance['type']:\n    'vlan'",
      "data": {
        "type": "vlan"
      }
    },
    {
      "description": "llama-70b generated negative",
      "valid": false,
      "rust_error": "Additional properties are not allowed ('extraProperty' was unexpected)",
      "python_error": "Additional properties are not allowed ('extraProperty' was unexpected)\n\nFailed validating 'additionalProperties' in schema:\n    {'$schema': 'http://json-schema.org/draft-04/schema#',\n     'id': 'http://judkins.house/apis/k2/v1/canalFabricNetworkVxlan.json',\n     '$$target': 'canalFabricNetworkVxlan.json',\n     'title': 'Canal Fabric VXLan Network configuration',\n     'description': 'Canal Fabric VXLan Network configuration.',\n     'properties': {'type': {'description': 'Indicates that it is vxlan.',\n                             'enum': ['vxlan'],\n                             'type': 'string',\n                             'default': 'vxlan'}},\n     'required': ['type'],\n     'additionalProperties': False,\n     'type': 'object'}\n\nOn instance:\n    {'type': 'vxlan', 'extraProperty': 'extraValue'}",
      "data": {
        "type": "vxlan",
        "extraProperty": "extraValue"
      }
    },
    {
      "description": "llama-70b generated negative",
      "valid": false,
      "rust_error": "true is not one of [\"vxlan\"]",
      "python_error": "True is not one of ['vxlan']\n\nFailed validating 'enum' in schema['properties']['type']:\n    {'description': 'Indicates that it is vxlan.',\n     'enum': ['vxlan'],\n     'type': 'string',\n     'default': 'vxlan'}\n\nOn instance['type']:\n    True",
      "data": {
        "type": true
      }
    }
  ]
}