{
  "description": "sample Github_easy/o58930.json",
  "meta": {
    "full_size": 394,
    "stripped_size": 298,
    "features": [
      "additionalProperties"
    ],
    "raw_features": [
      "$schema",
      "_boolSchema",
      "id",
      "properties",
      "required",
      "type",
      "type:object",
      "type:string"
    ]
  },
  "schema": {
    "$schema": "http://json-schema.org/draft-04/schema#",
    "additionalProperties": false,
    "description": "The JSON schema that matches a tag result.",
    "id": "https://mastert.github.io/bandcamp-scraper/schemas/tag-result.json",
    "properties": {
      "artist": {
        "type": "string"
      },
      "name": {
        "type": "string"
      },
      "url": {
        "_format": "uri",
        "type": "string"
      }
    },
    "required": [
      "name",
      "artist",
      "url"
    ],
    "title": "tag-result",
    "type": "object"
  },
  "tests": [
    {
      "description": "llama 70b generated valid",
      "valid": true,
      "data": {
        "artist": "The Artist Name",
        "name": "The Album Name",
        "url": "https://example.bandcamp.com/album/the-album-name"
      }
    },
    {
      "description": "llama-70b generated negative",
      "valid": false,
      "rust_error": "Additional properties are not allowed ('extraProperty' was unexpected)",
      "python_error": "Additional properties are not allowed ('extraProperty' was unexpected)\n\nFailed validating 'additionalProperties' in schema:\n    {'$schema': 'http://json-schema.org/draft-04/schema#',\n     'additionalProperties': False,\n     'description': 'The JSON schema that matches a tag result.',\n     'id': 'https://mastert.github.io/bandcamp-scraper/schemas/tag-result.json',\n     'properties': {'artist': {'type': 'string'},\n                    'name': {'type': 'string'},\n                    'url': {'_format': 'uri', 'type': 'string'}},\n     'required': ['name', 'artist', 'url'],\n     'title': 'tag-result',\n     'type': 'object'}\n\nOn instance:\n    {'artist': 'The Artist Name',\n     'name': 'The Album Name',\n     'url': 'https://example.bandcamp.com/album/the-album-name',\n     'extraProperty': 'This is an extra property'}",
      "data": {
        "artist": "The Artist Name",
        "name": "The Album Name",
        "url": "https://example.bandcamp.com/album/the-album-name",
        "extraProperty": "This is an extra property"
      }
    },
    {
      "description": "llama-70b generated negative",
      "valid": false,
      "rust_error": "123 is not of type \"string\"",
      "python_error": "123 is not of type 'string'\n\nFailed validating 'type' in schema['properties']['artist']:\n    {'type': 'string'}\n\nOn instance['artist']:\n    123",
      "data": {
        "artist": 123,
        "name": "The Album Name",
        "url": "https://example.bandcamp.com/album/the-album-name"
      }
    }
  ]
}