{
  "description": "sample Github_easy/o39176.json",
  "meta": {
    "full_size": 415,
    "stripped_size": 359,
    "features": [
      "additionalProperties",
      "enum"
    ],
    "raw_features": [
      "$schema",
      "_boolSchema",
      "properties",
      "required",
      "type",
      "type:object",
      "type:string"
    ]
  },
  "schema": {
    "$schema": "http://json-schema.org/draft-04/schema#",
    "type": "object",
    "additionalProperties": false,
    "required": [
      "type",
      "properties"
    ],
    "properties": {
      "type": {
        "type": "string",
        "enum": [
          "FeatureCollection"
        ]
      },
      "properties": {
        "type": "object",
        "additionalProperties": false,
        "properties": {
          "sensor": {
            "type": "string",
            "description": "the name of an existing sensor resource"
          },
          "name": {
            "type": "string"
          },
          "description": {
            "type": "string"
          }
        }
      }
    }
  },
  "tests": [
    {
      "description": "llama 70b generated valid",
      "valid": true,
      "data": {
        "type": "FeatureCollection",
        "properties": {
          "sensor": "temperature_sensor",
          "name": "Outdoor Temperature",
          "description": "The temperature outside the building"
        }
      }
    },
    {
      "description": "llama-70b generated negative",
      "valid": false,
      "rust_error": "Additional properties are not allowed ('extra_property' was unexpected)",
      "python_error": "Additional properties are not allowed ('extra_property' was unexpected)\n\nFailed validating 'additionalProperties' in schema['properties']['properties']:\n    {'type': 'object',\n     'additionalProperties': False,\n     'properties': {'sensor': {'type': 'string',\n                               'description': 'the name of an existing '\n                                              'sensor resource'},\n                    'name': {'type': 'string'},\n                    'description': {'type': 'string'}}}\n\nOn instance['properties']:\n    {'sensor': 'temperature_sensor',\n     'name': 'Outdoor Temperature',\n     'description': 'The temperature outside the building',\n     'extra_property': 'This is an extra property'}",
      "data": {
        "type": "FeatureCollection",
        "properties": {
          "sensor": "temperature_sensor",
          "name": "Outdoor Temperature",
          "description": "The temperature outside the building",
          "extra_property": "This is an extra property"
        }
      }
    },
    {
      "description": "llama-70b generated negative",
      "valid": false,
      "rust_error": "123 is not of type \"string\"",
      "python_error": "123 is not of type 'string'\n\nFailed validating 'type' in schema['properties']['properties']['properties']['name']:\n    {'type': 'string'}\n\nOn instance['properties']['name']:\n    123",
      "data": {
        "type": "FeatureCollection",
        "properties": {
          "sensor": "temperature_sensor",
          "name": 123,
          "description": "The temperature outside the building"
        }
      }
    },
    {
      "description": "llama 70b generated positive",
      "valid": true,
      "data": {
        "type": "FeatureCollection",
        "properties": {
          "sensor": "existing_sensor",
          "name": "Sensor Data",
          "description": "This is a collection of sensor data."
        }
      }
    },
    {
      "description": "llama-70b generated negative",
      "valid": false,
      "rust_error": "Additional properties are not allowed ('extraProperty' was unexpected)",
      "python_error": "Additional properties are not allowed ('extraProperty' was unexpected)\n\nFailed validating 'additionalProperties' in schema['properties']['properties']:\n    {'type': 'object',\n     'additionalProperties': False,\n     'properties': {'sensor': {'type': 'string',\n                               'description': 'the name of an existing '\n                                              'sensor resource'},\n                    'name': {'type': 'string'},\n                    'description': {'type': 'string'}}}\n\nOn instance['properties']:\n    {'sensor': 'existing_sensor',\n     'name': 'Sensor Data',\n     'description': 'This is a collection of sensor data.',\n     'extraProperty': 'Invalid'}",
      "data": {
        "type": "FeatureCollection",
        "properties": {
          "sensor": "existing_sensor",
          "name": "Sensor Data",
          "description": "This is a collection of sensor data.",
          "extraProperty": "Invalid"
        }
      }
    }
  ]
}