{
  "description": "sample Github_easy/o81583.json",
  "meta": {
    "full_size": 368,
    "stripped_size": 368,
    "features": [
      "additionalProperties",
      "dependencies",
      "items"
    ],
    "raw_features": [
      "$schema",
      "_boolSchema",
      "properties",
      "required",
      "type",
      "type:array",
      "type:object",
      "type:string"
    ]
  },
  "schema": {
    "$schema": "http://json-schema.org/draft-04/schema#",
    "type": "object",
    "properties": {
      "email": {
        "type": "string"
      },
      "firstName": {
        "type": "string"
      },
      "lastName": {
        "type": "string"
      },
      "tags": {
        "type": "array",
        "items": {
          "type": "string"
        }
      },
      "favoriteTopic": {
        "type": "string"
      }
    },
    "additionalProperties": false,
    "required": [
      "email",
      "firstName",
      "lastName"
    ],
    "dependencies": {
      "favoriteTopic": [
        "tags"
      ]
    }
  },
  "tests": [
    {
      "description": "llama 70b generated positive",
      "valid": true,
      "data": {
        "email": "john.doe@example.com",
        "firstName": "John",
        "lastName": "Doe",
        "tags": [
          "topic1",
          "topic2"
        ],
        "favoriteTopic": "topic1"
      }
    },
    {
      "description": "llama-70b generated negative; focus on dependencies keyword",
      "valid": false,
      "rust_error": "\"tags\" is a required property",
      "python_error": "'tags' is a dependency of 'favoriteTopic'\n\nFailed validating 'dependencies' in schema:\n    {'$schema': 'http://json-schema.org/draft-04/schema#',\n     'type': 'object',\n     'properties': {'email': {'type': 'string'},\n                    'firstName': {'type': 'string'},\n                    'lastName': {'type': 'string'},\n                    'tags': {'type': 'array', 'items': {'type': 'string'}},\n                    'favoriteTopic': {'type': 'string'}},\n     'additionalProperties': False,\n     'required': ['email', 'firstName', 'lastName'],\n     'dependencies': {'favoriteTopic': ['tags']}}\n\nOn instance:\n    {'email': 'john.doe@example.com',\n     'firstName': 'John',\n     'lastName': 'Doe',\n     'favoriteTopic': 'topic1'}",
      "data": {
        "email": "john.doe@example.com",
        "firstName": "John",
        "lastName": "Doe",
        "favoriteTopic": "topic1"
      }
    }
  ]
}