{
  "description": "sample Github_easy/o64532.json",
  "meta": {
    "full_size": 422,
    "stripped_size": 327,
    "features": [
      "additionalProperties"
    ],
    "raw_features": [
      "$schema",
      "_boolSchema",
      "properties",
      "required",
      "type",
      "type:boolean",
      "type:object",
      "type:string"
    ]
  },
  "schema": {
    "$schema": "http://json-schema.org/draft-04/schema#",
    "additionalProperties": false,
    "description": "Create a new user",
    "properties": {
      "admin": {
        "type": "boolean"
      },
      "callsign": {
        "type": "string"
      },
      "email": {
        "_format": "email",
        "type": "string"
      },
      "password": {
        "type": "string"
      },
      "passwordRepeat": {
        "type": "string"
      }
    },
    "required": [
      "callsign",
      "email",
      "admin",
      "password",
      "passwordRepeat"
    ],
    "title": "Service 001 : POST /users/create",
    "type": "object"
  },
  "tests": [
    {
      "description": "llama 70b generated valid",
      "valid": true,
      "data": {
        "admin": true,
        "callsign": "JohnDoe",
        "email": "johndoe@example.com",
        "password": "password123",
        "passwordRepeat": "password123"
      }
    },
    {
      "description": "llama-70b generated negative",
      "valid": false,
      "rust_error": "Additional properties are not allowed ('extraField' was unexpected)",
      "python_error": "Additional properties are not allowed ('extraField' was unexpected)\n\nFailed validating 'additionalProperties' in schema:\n    {'$schema': 'http://json-schema.org/draft-04/schema#',\n     'additionalProperties': False,\n     'description': 'Create a new user',\n     'properties': {'admin': {'type': 'boolean'},\n                    'callsign': {'type': 'string'},\n                    'email': {'_format': 'email', 'type': 'string'},\n                    'password': {'type': 'string'},\n                    'passwordRepeat': {'type': 'string'}},\n     'required': ['callsign',\n                  'email',\n                  'admin',\n                  'password',\n                  'passwordRepeat'],\n     'title': 'Service 001 : POST /users/create',\n     'type': 'object'}\n\nOn instance:\n    {'admin': True,\n     'callsign': 'JohnDoe',\n     'email': 'johndoe@example.com',\n     'password': 'password123',\n     'passwordRepeat': 'password123',\n     'extraField': 'extraValue'}",
      "data": {
        "admin": true,
        "callsign": "JohnDoe",
        "email": "johndoe@example.com",
        "password": "password123",
        "passwordRepeat": "password123",
        "extraField": "extraValue"
      }
    },
    {
      "description": "llama-70b generated negative",
      "valid": false,
      "rust_error": "Additional properties are not allowed ('extraProperty' was unexpected)",
      "python_error": "Additional properties are not allowed ('extraProperty' was unexpected)\n\nFailed validating 'additionalProperties' in schema:\n    {'$schema': 'http://json-schema.org/draft-04/schema#',\n     'additionalProperties': False,\n     'description': 'Create a new user',\n     'properties': {'admin': {'type': 'boolean'},\n                    'callsign': {'type': 'string'},\n                    'email': {'_format': 'email', 'type': 'string'},\n                    'password': {'type': 'string'},\n                    'passwordRepeat': {'type': 'string'}},\n     'required': ['callsign',\n                  'email',\n                  'admin',\n                  'password',\n                  'passwordRepeat'],\n     'title': 'Service 001 : POST /users/create',\n     'type': 'object'}\n\nOn instance:\n    {'admin': True,\n     'callsign': 'JohnDoe',\n     'email': 'johndoe@example.com',\n     'password': 'password123',\n     'passwordRepeat': 'password123',\n     'extraProperty': 'extraValue'}",
      "data": {
        "admin": true,
        "callsign": "JohnDoe",
        "email": "johndoe@example.com",
        "password": "password123",
        "passwordRepeat": "password123",
        "extraProperty": "extraValue"
      }
    }
  ]
}