{
  "description": "sample Github_easy/o43997.json",
  "meta": {
    "full_size": 346,
    "stripped_size": 276,
    "features": [
      "additionalProperties"
    ],
    "raw_features": [
      "$schema",
      "_boolSchema",
      "properties",
      "required",
      "type",
      "type:number",
      "type:object",
      "type:string"
    ]
  },
  "schema": {
    "$schema": "http://json-schema.org/draft-04/schema#",
    "additionalProperties": false,
    "properties": {
      "location": {
        "_format": "uri",
        "type": "string"
      },
      "retries": {
        "type": "number"
      },
      "retrieveDate": {
        "_format": "date-time",
        "type": "string"
      },
      "retryInterval": {
        "type": "number"
      }
    },
    "required": [
      "location",
      "retrieveDate"
    ],
    "title": "UpdateFirmwareRequest",
    "type": "object"
  },
  "tests": [
    {
      "description": "llama 70b generated valid",
      "valid": true,
      "data": {
        "location": "https://example.com/firmware.bin",
        "retrieveDate": "2022-01-01T12:00:00Z",
        "retryInterval": 300
      }
    },
    {
      "description": "llama-70b generated negative",
      "valid": false,
      "rust_error": "Additional properties are not allowed ('extraProperty' was unexpected)",
      "python_error": "Additional properties are not allowed ('extraProperty' was unexpected)\n\nFailed validating 'additionalProperties' in schema:\n    {'$schema': 'http://json-schema.org/draft-04/schema#',\n     'additionalProperties': False,\n     'properties': {'location': {'_format': 'uri', 'type': 'string'},\n                    'retries': {'type': 'number'},\n                    'retrieveDate': {'_format': 'date-time',\n                                     'type': 'string'},\n                    'retryInterval': {'type': 'number'}},\n     'required': ['location', 'retrieveDate'],\n     'title': 'UpdateFirmwareRequest',\n     'type': 'object'}\n\nOn instance:\n    {'location': 'https://example.com/firmware.bin',\n     'retrieveDate': '2022-01-01T12:00:00Z',\n     'retryInterval': 300,\n     'extraProperty': 'some value'}",
      "data": {
        "location": "https://example.com/firmware.bin",
        "retrieveDate": "2022-01-01T12:00:00Z",
        "retryInterval": 300,
        "extraProperty": "some value"
      }
    },
    {
      "description": "llama-70b generated negative",
      "valid": false,
      "rust_error": "Additional properties are not allowed ('extraProperty' was unexpected)",
      "python_error": "Additional properties are not allowed ('extraProperty' was unexpected)\n\nFailed validating 'additionalProperties' in schema:\n    {'$schema': 'http://json-schema.org/draft-04/schema#',\n     'additionalProperties': False,\n     'properties': {'location': {'_format': 'uri', 'type': 'string'},\n                    'retries': {'type': 'number'},\n                    'retrieveDate': {'_format': 'date-time',\n                                     'type': 'string'},\n                    'retryInterval': {'type': 'number'}},\n     'required': ['location', 'retrieveDate'],\n     'title': 'UpdateFirmwareRequest',\n     'type': 'object'}\n\nOn instance:\n    {'location': 'https://example.com/firmware.bin',\n     'retrieveDate': '2022-01-01T12:00:00Z',\n     'retryInterval': 300,\n     'extraProperty': 'value'}",
      "data": {
        "location": "https://example.com/firmware.bin",
        "retrieveDate": "2022-01-01T12:00:00Z",
        "retryInterval": 300,
        "extraProperty": "value"
      }
    },
    {
      "description": "llama 70b generated positive",
      "valid": true,
      "data": {
        "location": "https://example.com/firmware",
        "retries": 3,
        "retrieveDate": "2022-01-01T12:00:00Z",
        "retryInterval": 300
      }
    },
    {
      "description": "llama-70b generated negative",
      "valid": false,
      "rust_error": "Additional properties are not allowed ('additionalProperty' was unexpected)",
      "python_error": "Additional properties are not allowed ('additionalProperty' was unexpected)\n\nFailed validating 'additionalProperties' in schema:\n    {'$schema': 'http://json-schema.org/draft-04/schema#',\n     'additionalProperties': False,\n     'properties': {'location': {'_format': 'uri', 'type': 'string'},\n                    'retries': {'type': 'number'},\n                    'retrieveDate': {'_format': 'date-time',\n                                     'type': 'string'},\n                    'retryInterval': {'type': 'number'}},\n     'required': ['location', 'retrieveDate'],\n     'title': 'UpdateFirmwareRequest',\n     'type': 'object'}\n\nOn instance:\n    {'location': 'https://example.com/firmware',\n     'retrieveDate': '2022-01-01T12:00:00Z',\n     'retries': 3,\n     'retryInterval': 300,\n     'additionalProperty': 'corner case test'}",
      "data": {
        "location": "https://example.com/firmware",
        "retrieveDate": "2022-01-01T12:00:00Z",
        "retries": 3,
        "retryInterval": 300,
        "additionalProperty": "corner case test"
      }
    }
  ]
}