{
  "description": "sample Github_easy/o28256.json",
  "meta": {
    "full_size": 373,
    "stripped_size": 338,
    "features": [
      "additionalProperties"
    ],
    "raw_features": [
      "_boolSchema",
      "properties",
      "required",
      "type",
      "type:object",
      "type:string"
    ]
  },
  "schema": {
    "additionalProperties": false,
    "description": "",
    "properties": {
      "country_name": {
        "type": "string"
      },
      "extended_address": {
        "type": "string"
      },
      "locality": {
        "type": "string"
      },
      "post_office_box": {
        "type": "string"
      },
      "postal_code": {
        "type": "string"
      },
      "region": {
        "type": "string"
      },
      "street_address": {
        "type": "string"
      }
    },
    "required": [
      "country_name",
      "locality",
      "region"
    ],
    "title": "address",
    "type": "object"
  },
  "tests": [
    {
      "description": "llama 70b generated valid",
      "valid": true,
      "data": {
        "country_name": "United States",
        "locality": "New York",
        "region": "New York",
        "street_address": "123 Main St, Apt 101"
      }
    },
    {
      "description": "llama-70b generated negative",
      "valid": false,
      "rust_error": "Additional properties are not allowed ('extra_property' was unexpected)",
      "python_error": "Additional properties are not allowed ('extra_property' was unexpected)\n\nFailed validating 'additionalProperties' in schema:\n    {'additionalProperties': False,\n     'description': '',\n     'properties': {'country_name': {'type': 'string'},\n                    'extended_address': {'type': 'string'},\n                    'locality': {'type': 'string'},\n                    'post_office_box': {'type': 'string'},\n                    'postal_code': {'type': 'string'},\n                    'region': {'type': 'string'},\n                    'street_address': {'type': 'string'}},\n     'required': ['country_name', 'locality', 'region'],\n     'title': 'address',\n     'type': 'object'}\n\nOn instance:\n    {'country_name': 'United States',\n     'locality': 'New York',\n     'region': 'New York',\n     'street_address': '123 Main St, Apt 101',\n     'extra_property': 'Invalid'}",
      "data": {
        "country_name": "United States",
        "locality": "New York",
        "region": "New York",
        "street_address": "123 Main St, Apt 101",
        "extra_property": "Invalid"
      }
    },
    {
      "description": "llama-70b generated negative",
      "valid": false,
      "rust_error": "Additional properties are not allowed ('extra_property' was unexpected)",
      "python_error": "Additional properties are not allowed ('extra_property' was unexpected)\n\nFailed validating 'additionalProperties' in schema:\n    {'additionalProperties': False,\n     'description': '',\n     'properties': {'country_name': {'type': 'string'},\n                    'extended_address': {'type': 'string'},\n                    'locality': {'type': 'string'},\n                    'post_office_box': {'type': 'string'},\n                    'postal_code': {'type': 'string'},\n                    'region': {'type': 'string'},\n                    'street_address': {'type': 'string'}},\n     'required': ['country_name', 'locality', 'region'],\n     'title': 'address',\n     'type': 'object'}\n\nOn instance:\n    {'country_name': 'United States',\n     'locality': 'New York',\n     'region': 'New York',\n     'street_address': '123 Main St, Apt 101',\n     'extra_property': 'extra_value'}",
      "data": {
        "country_name": "United States",
        "locality": "New York",
        "region": "New York",
        "street_address": "123 Main St, Apt 101",
        "extra_property": "extra_value"
      }
    },
    {
      "description": "llama 70b generated positive",
      "valid": true,
      "data": {
        "country_name": "United States",
        "extended_address": "Apt 101",
        "locality": "New York",
        "postal_code": "10001",
        "region": "New York",
        "street_address": "123 Main St"
      }
    },
    {
      "description": "llama-70b generated negative",
      "valid": false,
      "rust_error": "Additional properties are not allowed ('extra_property' was unexpected)",
      "python_error": "Additional properties are not allowed ('extra_property' was unexpected)\n\nFailed validating 'additionalProperties' in schema:\n    {'additionalProperties': False,\n     'description': '',\n     'properties': {'country_name': {'type': 'string'},\n                    'extended_address': {'type': 'string'},\n                    'locality': {'type': 'string'},\n                    'post_office_box': {'type': 'string'},\n                    'postal_code': {'type': 'string'},\n                    'region': {'type': 'string'},\n                    'street_address': {'type': 'string'}},\n     'required': ['country_name', 'locality', 'region'],\n     'title': 'address',\n     'type': 'object'}\n\nOn instance:\n    {'country_name': 'United States',\n     'locality': 'New York',\n     'region': 'New York',\n     'street_address': '123 Main St',\n     'postal_code': '10001',\n     'extended_address': 'Apt 101',\n     'extra_property': 'invalid'}",
      "data": {
        "country_name": "United States",
        "locality": "New York",
        "region": "New York",
        "street_address": "123 Main St",
        "postal_code": "10001",
        "extended_address": "Apt 101",
        "extra_property": "invalid"
      }
    }
  ]
}