{
  "description": "sample Github_easy/o69579.json",
  "meta": {
    "full_size": 451,
    "stripped_size": 329,
    "features": [
      "$ref",
      "additionalProperties"
    ],
    "raw_features": [
      "$schema",
      "_boolSchema",
      "definitions",
      "id",
      "properties",
      "required",
      "type",
      "type:object",
      "type:string"
    ]
  },
  "schema": {
    "id": "http://plugged-in.x-c-o-d-e.com/schema/configuration+v1#",
    "$schema": "http://json-schema.org/draft-04/schema#",
    "description": "Describes the plugged-in configuration",
    "type": "object",
    "additionalProperties": false,
    "required": [
      "context",
      "provides"
    ],
    "properties": {
      "context": {
        "description": "The plugin context",
        "type": "string"
      },
      "provides": {
        "$ref": "#/definitions/provides"
      }
    },
    "definitions": {
      "provides": {
        "description": "Provides object",
        "type": "object"
      }
    }
  },
  "tests": [
    {
      "description": "llama 70b generated valid",
      "valid": true,
      "data": {
        "context": "example-context",
        "provides": {}
      }
    },
    {
      "description": "llama-70b generated negative",
      "valid": false,
      "rust_error": "Additional properties are not allowed ('extraProperty' was unexpected)",
      "python_error": "Additional properties are not allowed ('extraProperty' was unexpected)\n\nFailed validating 'additionalProperties' in schema:\n    {'id': 'http://plugged-in.x-c-o-d-e.com/schema/configuration+v1#',\n     '$schema': 'http://json-schema.org/draft-04/schema#',\n     'description': 'Describes the plugged-in configuration',\n     'type': 'object',\n     'additionalProperties': False,\n     'required': ['context', 'provides'],\n     'properties': {'context': {'description': 'The plugin context',\n                                'type': 'string'},\n                    'provides': {'$ref': '#/definitions/provides'}},\n     'definitions': {'provides': {'description': 'Provides object',\n                                  'type': 'object'}}}\n\nOn instance:\n    {'context': 'example-context',\n     'provides': {},\n     'extraProperty': 'extraValue'}",
      "data": {
        "context": "example-context",
        "provides": {},
        "extraProperty": "extraValue"
      }
    },
    {
      "description": "llama-70b generated negative",
      "valid": false,
      "rust_error": "null is not of type \"object\"",
      "python_error": "None is not of type 'object'\n\nFailed validating 'type' in schema['properties']['provides']:\n    {'description': 'Provides object', 'type': 'object'}\n\nOn instance['provides']:\n    None",
      "data": {
        "context": "example-context",
        "provides": null
      }
    }
  ]
}