{
  "description": "sample Github_easy/o44363.json",
  "meta": {
    "full_size": 341,
    "stripped_size": 341,
    "features": [
      "additionalProperties",
      "format",
      "format:date-time"
    ],
    "raw_features": [
      "$schema",
      "_boolSchema",
      "id",
      "properties",
      "required",
      "type",
      "type:object",
      "type:string"
    ]
  },
  "schema": {
    "$schema": "http://json-schema.org/draft-04/schema#",
    "id": "http://schema.envirocar.org/phenomenon.json#",
    "type": "object",
    "additionalProperties": false,
    "required": [
      "name",
      "unit"
    ],
    "properties": {
      "name": {
        "type": "string"
      },
      "unit": {
        "type": "string"
      },
      "created": {
        "type": "string",
        "format": "date-time"
      },
      "modified": {
        "type": "string",
        "format": "date-time"
      }
    }
  },
  "tests": [
    {
      "description": "llama 70b generated valid",
      "valid": true,
      "data": {
        "name": "Temperature",
        "unit": "Celsius",
        "created": "2022-01-01T12:00:00Z",
        "modified": "2022-01-01T12:00:00Z"
      }
    },
    {
      "description": "llama-70b generated negative; focus on format keyword",
      "valid": false,
      "rust_error": "\"2022-01-01T12:00:00\" is not a \"date-time\"",
      "python_error": "'2022-01-01T12:00:00' is not a 'date-time'\n\nFailed validating 'format' in schema['properties']['created']:\n    {'type': 'string', 'format': 'date-time'}\n\nOn instance['created']:\n    '2022-01-01T12:00:00'",
      "data": {
        "name": "Temperature",
        "unit": "Celsius",
        "created": "2022-01-01T12:00:00",
        "modified": "2022-01-01T12:00:00Z"
      }
    },
    {
      "description": "llama-70b generated negative",
      "valid": false,
      "rust_error": "Additional properties are not allowed ('extraProperty' was unexpected)",
      "python_error": "Additional properties are not allowed ('extraProperty' was unexpected)\n\nFailed validating 'additionalProperties' in schema:\n    {'$schema': 'http://json-schema.org/draft-04/schema#',\n     'id': 'http://schema.envirocar.org/phenomenon.json#',\n     'type': 'object',\n     'additionalProperties': False,\n     'required': ['name', 'unit'],\n     'properties': {'name': {'type': 'string'},\n                    'unit': {'type': 'string'},\n                    'created': {'type': 'string', 'format': 'date-time'},\n                    'modified': {'type': 'string', 'format': 'date-time'}}}\n\nOn instance:\n    {'name': 'Temperature',\n     'unit': 'Celsius',\n     'created': '2022-01-01T12:00:00Z',\n     'modified': '2022-01-01T12:00:00Z',\n     'extraProperty': 'Invalid'}",
      "data": {
        "name": "Temperature",
        "unit": "Celsius",
        "created": "2022-01-01T12:00:00Z",
        "modified": "2022-01-01T12:00:00Z",
        "extraProperty": "Invalid"
      }
    },
    {
      "description": "llama-70b generated negative",
      "valid": false,
      "rust_error": "Additional properties are not allowed ('extraProperty' was unexpected)",
      "python_error": "Additional properties are not allowed ('extraProperty' was unexpected)\n\nFailed validating 'additionalProperties' in schema:\n    {'$schema': 'http://json-schema.org/draft-04/schema#',\n     'id': 'http://schema.envirocar.org/phenomenon.json#',\n     'type': 'object',\n     'additionalProperties': False,\n     'required': ['name', 'unit'],\n     'properties': {'name': {'type': 'string'},\n                    'unit': {'type': 'string'},\n                    'created': {'type': 'string', 'format': 'date-time'},\n                    'modified': {'type': 'string', 'format': 'date-time'}}}\n\nOn instance:\n    {'name': 'Temperature',\n     'unit': 'Celsius',\n     'created': '2022-01-01T12:00:00Z',\n     'modified': '2022-01-01T12:00:00Z',\n     'extraProperty': 'extraValue'}",
      "data": {
        "name": "Temperature",
        "unit": "Celsius",
        "created": "2022-01-01T12:00:00Z",
        "modified": "2022-01-01T12:00:00Z",
        "extraProperty": "extraValue"
      }
    },
    {
      "description": "llama 70b generated positive",
      "valid": true,
      "data": {
        "name": "Carbon Dioxide Emissions",
        "unit": "g/km",
        "created": "2022-01-01T12:00:00Z",
        "modified": "2022-01-01T12:00:00Z"
      }
    },
    {
      "description": "llama-70b generated negative; focus on format keyword",
      "valid": false,
      "rust_error": "\"Invalid Date\" is not a \"date-time\"",
      "python_error": "'Invalid Date' is not a 'date-time'\n\nFailed validating 'format' in schema['properties']['created']:\n    {'type': 'string', 'format': 'date-time'}\n\nOn instance['created']:\n    'Invalid Date'",
      "data": {
        "name": "Carbon Dioxide Emissions",
        "unit": "g/km",
        "created": "Invalid Date",
        "modified": "2022-01-01T12:00:00Z"
      }
    }
  ]
}