{
  "description": "sample Github_easy/o43999.json",
  "meta": {
    "full_size": 346,
    "stripped_size": 289,
    "features": [
      "additionalProperties",
      "enum"
    ],
    "raw_features": [
      "$schema",
      "_boolSchema",
      "properties",
      "required",
      "type",
      "type:number",
      "type:object",
      "type:string"
    ]
  },
  "schema": {
    "$schema": "http://json-schema.org/draft-04/schema#",
    "additionalProperties": false,
    "properties": {
      "currentTime": {
        "_format": "date-time",
        "type": "string"
      },
      "interval": {
        "type": "number"
      },
      "status": {
        "enum": [
          "Accepted",
          "Pending",
          "Rejected"
        ],
        "type": "string"
      }
    },
    "required": [
      "status",
      "currentTime",
      "interval"
    ],
    "title": "BootNotificationResponse",
    "type": "object"
  },
  "tests": [
    {
      "description": "llama 70b generated valid",
      "valid": true,
      "data": {
        "currentTime": "2022-01-01T12:00:00Z",
        "interval": 10,
        "status": "Accepted"
      }
    },
    {
      "description": "llama-70b generated negative",
      "valid": false,
      "rust_error": "Additional properties are not allowed ('extraProperty' was unexpected)",
      "python_error": "Additional properties are not allowed ('extraProperty' was unexpected)\n\nFailed validating 'additionalProperties' in schema:\n    {'$schema': 'http://json-schema.org/draft-04/schema#',\n     'additionalProperties': False,\n     'properties': {'currentTime': {'_format': 'date-time',\n                                    'type': 'string'},\n                    'interval': {'type': 'number'},\n                    'status': {'enum': ['Accepted', 'Pending', 'Rejected'],\n                               'type': 'string'}},\n     'required': ['status', 'currentTime', 'interval'],\n     'title': 'BootNotificationResponse',\n     'type': 'object'}\n\nOn instance:\n    {'currentTime': '2022-01-01T12:00:00',\n     'interval': 10,\n     'status': 'Accepted',\n     'extraProperty': 'extraValue'}",
      "data": {
        "currentTime": "2022-01-01T12:00:00",
        "interval": 10,
        "status": "Accepted",
        "extraProperty": "extraValue"
      }
    }
  ]
}