{
  "description": "sample Github_medium/o8477.json",
  "meta": {
    "full_size": 832,
    "stripped_size": 646,
    "features": [
      "additionalProperties",
      "enum"
    ],
    "raw_features": [
      "$id",
      "$schema",
      "_boolSchema",
      "properties",
      "required",
      "type",
      "type:object",
      "type:string"
    ]
  },
  "schema": {
    "$schema": "http://json-schema.org/draft-06/schema#",
    "type": "object",
    "additionalProperties": false,
    "properties": {
      "chassis": {
        "src": "https://spacetelescope.github.io/understanding-json-schema/reference/object.html#dependencies",
        "title": "Chassis information",
        "type": "object",
        "properties": {
          "chassis_detail": {
            "$id": "/properties/chassis_detail",
            "title": "Chassis detail",
            "type": "string",
            "enum": [
              "chassis alarms",
              "chassis environment",
              "chassis environment cb",
              "chassis environment fpc",
              "chassis environment pem",
              "chassis environment routing-engine",
              "chassis fpc detail",
              "chassis fan",
              "chassis firmware",
              "chassis mac-addresses",
              "chassis routing-engine",
              "chassis power",
              "chassis hardware",
              "chassis hardware detail",
              "chassis hardware clei-models",
              "chassis temperature-thresholds"
            ],
            "default": "chassis hardware"
          }
        },
        "required": [
          "chassis_detail"
        ]
      }
    }
  },
  "tests": [
    {
      "description": "llama 70b generated valid",
      "valid": true,
      "data": {
        "chassis": {
          "chassis_detail": "chassis hardware"
        }
      }
    },
    {
      "description": "llama-70b generated negative",
      "valid": false,
      "rust_error": "\"Invalid Value\" is not one of [\"chassis alarms\",\"chassis environment\",\"chassis environment cb\",\"chassis environment fpc\",\"chassis environment pem\",\"chassis environment routing-engine\",\"chassis fpc detail\",\"chassis fan\",\"chassis firmware\",\"chassis mac-addresses\",\"chassis routing-engine\",\"chassis power\",\"chassis hardware\",\"chassis hardware detail\",\"chassis hardware clei-models\",\"chassis temperature-thresholds\"]",
      "python_error": "'Invalid Value' is not one of ['chassis alarms', 'chassis environment', 'chassis environment cb', 'chassis environment fpc', 'chassis environment pem', 'chassis environment routing-engine', 'chassis fpc detail', 'chassis fan', 'chassis firmware', 'chassis mac-addresses', 'chassis routing-engine', 'chassis power', 'chassis hardware', 'chassis hardware detail', 'chassis hardware clei-models', 'chassis temperature-thresholds']\n\nFailed validating 'enum' in schema['properties']['chassis']['properties']['chassis_detail']:\n    {'$id': '/properties/chassis_detail',\n     'title': 'Chassis detail',\n     'type': 'string',\n     'enum': ['chassis alarms',\n              'chassis environment',\n              'chassis environment cb',\n              'chassis environment fpc',\n              'chassis environment pem',\n              'chassis environment routing-engine',\n              'chassis fpc detail',\n              'chassis fan',\n              'chassis firmware',\n              'chassis mac-addresses',\n              'chassis r.. (315 more)",
      "data": {
        "chassis": {
          "chassis_detail": "Invalid Value"
        }
      }
    }
  ]
}