{
  "description": "sample Github_easy/o62650.json",
  "meta": {
    "full_size": 478,
    "stripped_size": 415,
    "features": [
      "$ref",
      "@minmaxLength",
      "additionalProperties"
    ],
    "raw_features": [
      "$schema",
      "_boolSchema",
      "definitions",
      "id",
      "minLength",
      "properties",
      "required",
      "type",
      "type:object",
      "type:string"
    ]
  },
  "schema": {
    "id": "http://n7space.com/asn1-lib-general-schema.json",
    "$schema": "http://json-schema.org/draft-04/schema#",
    "description": "ASN.1 Types Library General Information schema",
    "definitions": {
      "nonEmptyString": {
        "type": "string",
        "minLength": 1
      }
    },
    "type": "object",
    "properties": {
      "name": {
        "$ref": "#/definitions/nonEmptyString"
      },
      "description": {
        "type": "string"
      },
      "vendor": {
        "type": "string"
      },
      "version": {
        "type": "string"
      },
      "license": {
        "type": "string"
      }
    },
    "required": [
      "name"
    ],
    "additionalProperties": false
  },
  "tests": [
    {
      "description": "llama 70b generated valid",
      "valid": true,
      "data": {
        "name": "ASN.1 Library",
        "description": "A library for working with ASN.1 types",
        "vendor": "N7 Space",
        "version": "1.0.0",
        "license": "MIT"
      }
    },
    {
      "description": "llama-70b generated negative; focus on minLength keyword",
      "valid": false,
      "rust_error": "\"\" is shorter than 1 character",
      "python_error": "'' should be non-empty\n\nFailed validating 'minLength' in schema['properties']['name']:\n    {'type': 'string', 'minLength': 1}\n\nOn instance['name']:\n    ''",
      "data": {
        "name": "",
        "description": "A library for working with ASN.1 types",
        "vendor": "N7 Space",
        "version": "1.0.0",
        "license": "MIT"
      }
    },
    {
      "description": "llama-70b generated negative",
      "valid": false,
      "rust_error": "\"\" is shorter than 1 character",
      "python_error": "Additional properties are not allowed ('extraProp' was unexpected)\n\nFailed validating 'additionalProperties' in schema:\n    {'id': 'http://n7space.com/asn1-lib-general-schema.json',\n     '$schema': 'http://json-schema.org/draft-04/schema#',\n     'description': 'ASN.1 Types Library General Information schema',\n     'definitions': {'nonEmptyString': {'type': 'string', 'minLength': 1}},\n     'type': 'object',\n     'properties': {'name': {'$ref': '#/definitions/nonEmptyString'},\n                    'description': {'type': 'string'},\n                    'vendor': {'type': 'string'},\n                    'version': {'type': 'string'},\n                    'license': {'type': 'string'}},\n     'required': ['name'],\n     'additionalProperties': False}\n\nOn instance:\n    {'name': '',\n     'description': 'A library for working with ASN.1 types',\n     'vendor': 'N7 Space',\n     'version': '1.0.0',\n     'license': 'MIT',\n     'extraProp': 'Invalid'}",
      "data": {
        "name": "",
        "description": "A library for working with ASN.1 types",
        "vendor": "N7 Space",
        "version": "1.0.0",
        "license": "MIT",
        "extraProp": "Invalid"
      }
    }
  ]
}