{
  "description": "sample Github_easy/o40224.json",
  "meta": {
    "full_size": 271,
    "stripped_size": 271,
    "features": [
      "@minmaxLength",
      "additionalProperties"
    ],
    "raw_features": [
      "$schema",
      "_boolSchema",
      "maxLength",
      "properties",
      "required",
      "type",
      "type:object",
      "type:string"
    ]
  },
  "schema": {
    "$schema": "http://json-schema.org/draft-07/schema#",
    "type": "object",
    "properties": {
      "name": {
        "type": "string",
        "maxLength": 40
      },
      "email": {
        "type": "string",
        "maxLength": 60
      },
      "theme": {
        "type": "string",
        "maxLength": 40
      }
    },
    "required": [
      "name",
      "email",
      "theme"
    ],
    "additionalProperties": false
  },
  "tests": [
    {
      "description": "llama 70b generated valid",
      "valid": true,
      "data": {
        "name": "John Doe",
        "email": "john.doe@example.com",
        "theme": "Dark Mode"
      }
    },
    {
      "description": "llama-70b generated negative; focus on maxLength keyword",
      "valid": false,
      "rust_error": "\"John Doe is a very long name that exceeds the maximum allowed length of 40 characters\" is longer than 40 characters",
      "python_error": "'John Doe is a very long name that exceeds the maximum allowed length of 40 characters' is too long\n\nFailed validating 'maxLength' in schema['properties']['name']:\n    {'type': 'string', 'maxLength': 40}\n\nOn instance['name']:\n    ('John Doe is a very long name that exceeds the maximum allowed length '\n     'of 40 characters')",
      "data": {
        "name": "John Doe is a very long name that exceeds the maximum allowed length of 40 characters",
        "email": "john.doe@example.com",
        "theme": "Dark Mode"
      }
    },
    {
      "description": "llama-70b generated negative",
      "valid": false,
      "rust_error": "Additional properties are not allowed ('extraProperty' was unexpected)",
      "python_error": "Additional properties are not allowed ('extraProperty' was unexpected)\n\nFailed validating 'additionalProperties' in schema:\n    {'$schema': 'http://json-schema.org/draft-07/schema#',\n     'type': 'object',\n     'properties': {'name': {'type': 'string', 'maxLength': 40},\n                    'email': {'type': 'string', 'maxLength': 60},\n                    'theme': {'type': 'string', 'maxLength': 40}},\n     'required': ['name', 'email', 'theme'],\n     'additionalProperties': False}\n\nOn instance:\n    {'name': 'John Doe',\n     'email': 'john.doe@example.com',\n     'theme': 'Dark Mode',\n     'extraProperty': 'Invalid'}",
      "data": {
        "name": "John Doe",
        "email": "john.doe@example.com",
        "theme": "Dark Mode",
        "extraProperty": "Invalid"
      }
    },
    {
      "description": "llama-70b generated negative",
      "valid": false,
      "rust_error": "Additional properties are not allowed ('invalidProperty' was unexpected)",
      "python_error": "Additional properties are not allowed ('invalidProperty' was unexpected)\n\nFailed validating 'additionalProperties' in schema:\n    {'$schema': 'http://json-schema.org/draft-07/schema#',\n     'type': 'object',\n     'properties': {'name': {'type': 'string', 'maxLength': 40},\n                    'email': {'type': 'string', 'maxLength': 60},\n                    'theme': {'type': 'string', 'maxLength': 40}},\n     'required': ['name', 'email', 'theme'],\n     'additionalProperties': False}\n\nOn instance:\n    {'name': 'John Doe',\n     'email': 'john.doe@example.com',\n     'theme': 'Dark Mode',\n     'invalidProperty': 'Invalid'}",
      "data": {
        "name": "John Doe",
        "email": "john.doe@example.com",
        "theme": "Dark Mode",
        "invalidProperty": "Invalid"
      }
    }
  ]
}