{
  "description": "sample Github_easy/o45401.json",
  "meta": {
    "full_size": 424,
    "stripped_size": 169,
    "features": [
      "additionalProperties",
      "format",
      "format:path"
    ],
    "raw_features": [
      "_boolSchema",
      "_requiredEmpty",
      "properties",
      "required",
      "type",
      "type:object",
      "type:string"
    ]
  },
  "schema": {
    "additionalProperties": false,
    "properties": {
      "name": {
        "$default": {
          "$source": "argv",
          "index": 0
        },
        "description": "The name of the enum.",
        "type": "string"
      },
      "path": {
        "description": "The path to create the enum.",
        "format": "path",
        "type": "string",
        "visible": false
      },
      "project": {
        "$default": {
          "$source": "projectName"
        },
        "description": "The name of the project.",
        "type": "string"
      }
    },
    "required": [],
    "title": "Angular Enum Options Schema",
    "type": "object"
  },
  "tests": [
    {
      "description": "llama 70b generated positive",
      "valid": true,
      "data": {
        "name": "MyEnum",
        "path": "/path/to/enum",
        "project": "MyProject"
      }
    },
    {
      "description": "llama 70b generated positive",
      "valid": true,
      "data": {
        "name": "My Enum",
        "path": "/path/to/enum",
        "project": "My Project"
      }
    },
    {
      "description": "llama-70b generated negative",
      "valid": false,
      "rust_error": "Additional properties are not allowed ('extraproperty' was unexpected)",
      "python_error": "Additional properties are not allowed ('extraproperty' was unexpected)\n\nFailed validating 'additionalProperties' in schema:\n    {'additionalProperties': False,\n     'properties': {'name': {'$default': {'$source': 'argv', 'index': 0},\n                             'description': 'The name of the enum.',\n                             'type': 'string'},\n                    'path': {'description': 'The path to create the enum.',\n                             'format': 'path',\n                             'type': 'string',\n                             'visible': False},\n                    'project': {'$default': {'$source': 'projectName'},\n                                'description': 'The name of the project.',\n                                'type': 'string'}},\n     'required': [],\n     'title': 'Angular Enum Options Schema',\n     'type': 'object'}\n\nOn instance:\n    {'name': 'My Enum',\n     'path': '/path/to/enum',\n     'project': 'My Project',\n     'extraproperty': 'value'}",
      "data": {
        "name": "My Enum",
        "path": "/path/to/enum",
        "project": "My Project",
        "extraproperty": "value"
      }
    }
  ]
}