{
  "description": "sample Github_easy/o81589.json",
  "meta": {
    "full_size": 259,
    "stripped_size": 259,
    "features": [
      "additionalProperties"
    ],
    "raw_features": [
      "$schema",
      "_boolSchema",
      "properties",
      "type",
      "type:boolean",
      "type:number",
      "type:object",
      "type:string"
    ]
  },
  "schema": {
    "$schema": "http://json-schema.org/draft-04/schema#",
    "type": "object",
    "properties": {
      "email": {
        "type": "string"
      },
      "firstName": {
        "type": "string"
      },
      "lastName": {
        "type": "string"
      },
      "postedSlides": {
        "type": "boolean"
      },
      "rating": {
        "type": "number"
      }
    },
    "additionalProperties": false
  },
  "tests": [
    {
      "description": "llama 70b generated valid",
      "valid": true,
      "data": {
        "email": "john.doe@example.com",
        "firstName": "John",
        "lastName": "Doe",
        "postedSlides": true,
        "rating": 4.5
      }
    },
    {
      "description": "llama-70b generated negative",
      "valid": false,
      "rust_error": "Additional properties are not allowed ('extraProperty' was unexpected)",
      "python_error": "Additional properties are not allowed ('extraProperty' was unexpected)\n\nFailed validating 'additionalProperties' in schema:\n    {'$schema': 'http://json-schema.org/draft-04/schema#',\n     'type': 'object',\n     'properties': {'email': {'type': 'string'},\n                    'firstName': {'type': 'string'},\n                    'lastName': {'type': 'string'},\n                    'postedSlides': {'type': 'boolean'},\n                    'rating': {'type': 'number'}},\n     'additionalProperties': False}\n\nOn instance:\n    {'email': 'john.doe@example.com',\n     'firstName': 'John',\n     'lastName': 'Doe',\n     'postedSlides': True,\n     'rating': 4.5,\n     'extraProperty': 'Invalid'}",
      "data": {
        "email": "john.doe@example.com",
        "firstName": "John",
        "lastName": "Doe",
        "postedSlides": true,
        "rating": 4.5,
        "extraProperty": "Invalid"
      }
    }
  ]
}