{
  "description": "sample Github_easy/o6235.json",
  "meta": {
    "full_size": 258,
    "stripped_size": 240,
    "features": [
      "@minmaxLength",
      "additionalProperties",
      "enum"
    ],
    "raw_features": [
      "$schema",
      "_boolSchema",
      "maxLength",
      "properties",
      "required",
      "type",
      "type:object",
      "type:string"
    ]
  },
  "schema": {
    "$schema": "http://json-schema.org/draft-04/schema#",
    "additionalProperties": false,
    "properties": {
      "email": {
        "_format": "email",
        "maxLength": 1024,
        "type": "string"
      },
      "role": {
        "enum": [
          "admin",
          "edit",
          "view"
        ],
        "type": "string"
      }
    },
    "required": [
      "email",
      "role"
    ],
    "type": "object"
  },
  "tests": [
    {
      "description": "llama 70b generated valid",
      "valid": true,
      "data": {
        "email": "example@example.com",
        "role": "admin"
      }
    },
    {
      "description": "llama-70b generated negative",
      "valid": false,
      "rust_error": "\"invalid\" is not one of [\"admin\",\"edit\",\"view\"]",
      "python_error": "'invalid' is not one of ['admin', 'edit', 'view']\n\nFailed validating 'enum' in schema['properties']['role']:\n    {'enum': ['admin', 'edit', 'view'], 'type': 'string'}\n\nOn instance['role']:\n    'invalid'",
      "data": {
        "email": "example@example.com",
        "role": "invalid"
      }
    },
    {
      "description": "llama-70b generated negative",
      "valid": false,
      "rust_error": "Additional properties are not allowed ('extraProperty' was unexpected)",
      "python_error": "Additional properties are not allowed ('extraProperty' was unexpected)\n\nFailed validating 'additionalProperties' in schema:\n    {'$schema': 'http://json-schema.org/draft-04/schema#',\n     'additionalProperties': False,\n     'properties': {'email': {'_format': 'email',\n                              'maxLength': 1024,\n                              'type': 'string'},\n                    'role': {'enum': ['admin', 'edit', 'view'],\n                             'type': 'string'}},\n     'required': ['email', 'role'],\n     'type': 'object'}\n\nOn instance:\n    {'email': 'example@example.com',\n     'role': 'admin',\n     'extraProperty': 'value'}",
      "data": {
        "email": "example@example.com",
        "role": "admin",
        "extraProperty": "value"
      }
    }
  ]
}