{
  "description": "sample Glaiveai2K/calculate_area_d3fc7d7f.json",
  "meta": {
    "full_size": 627,
    "stripped_size": 325,
    "features": [],
    "raw_features": [
      "properties",
      "required",
      "type",
      "type:number",
      "type:object",
      "type:string"
    ]
  },
  "schema": {
    "properties": {
      "dimensions": {
        "description": "The dimensions of the shape",
        "properties": {
          "base": {
            "description": "The base of the shape",
            "type": "number"
          },
          "height": {
            "description": "The height of the shape",
            "type": "number"
          },
          "length": {
            "description": "The length of the shape",
            "type": "number"
          },
          "radius": {
            "description": "The radius of the shape",
            "type": "number"
          },
          "width": {
            "description": "The width of the shape",
            "type": "number"
          }
        },
        "required": [
          "length",
          "width",
          "radius",
          "base",
          "height"
        ],
        "type": "object"
      },
      "shape": {
        "description": "The shape (e.g. rectangle, circle, triangle)",
        "type": "string"
      }
    },
    "required": [
      "shape",
      "dimensions"
    ],
    "type": "object"
  },
  "tests": [
    {
      "description": "llama 70b generated positive",
      "valid": true,
      "data": {
        "dimensions": {
          "base": 10.5,
          "height": 20.2,
          "length": 30.1,
          "radius": 0,
          "width": 15.9
        },
        "shape": "rectangle"
      }
    },
    {
      "description": "llama-70b generated negative",
      "valid": false,
      "rust_error": "\"length\" is a required property",
      "python_error": "'length' is a required property\n\nFailed validating 'required' in schema['properties']['dimensions']:\n    {'description': 'The dimensions of the shape',\n     'properties': {'base': {'description': 'The base of the shape',\n                             'type': 'number'},\n                    'height': {'description': 'The height of the shape',\n                               'type': 'number'},\n                    'length': {'description': 'The length of the shape',\n                               'type': 'number'},\n                    'radius': {'description': 'The radius of the shape',\n                               'type': 'number'},\n                    'width': {'description': 'The width of the shape',\n                              'type': 'number'}},\n     'required': ['length', 'width', 'radius', 'base', 'height'],\n     'type': 'object'}\n\nOn instance['dimensions']:\n    {'base': 10.5, 'height': 20.2, 'radius': 0, 'width': 15.9}",
      "data": {
        "shape": "rectangle",
        "dimensions": {
          "base": 10.5,
          "height": 20.2,
          "radius": 0,
          "width": 15.9
        }
      }
    }
  ]
}