{
  "description": "sample Snowplow/sp_148_Normalized.json",
  "meta": {
    "full_size": 322,
    "stripped_size": 175,
    "features": [
      "additionalProperties"
    ],
    "raw_features": [
      "_boolSchema",
      "properties",
      "required",
      "type",
      "type:object",
      "type:string"
    ]
  },
  "schema": {
    "additionalProperties": false,
    "description": "Schema for a social event",
    "properties": {
      "action": {
        "type": "string"
      },
      "network": {
        "type": "string"
      },
      "target": {
        "type": "string"
      }
    },
    "required": [
      "network",
      "action"
    ],
    "self": {
      "format": "jsonschema",
      "name": "social_event",
      "vendor": "com.mparticle.snowplow",
      "version": "1-0-0"
    },
    "type": "object"
  },
  "tests": [
    {
      "description": "llama 70b generated valid",
      "valid": true,
      "data": {
        "action": "like",
        "network": "Facebook",
        "target": "post_123"
      }
    },
    {
      "description": "llama-70b generated negative",
      "valid": false,
      "rust_error": "Additional properties are not allowed ('extra_property' was unexpected)",
      "python_error": "Additional properties are not allowed ('extra_property' was unexpected)\n\nFailed validating 'additionalProperties' in schema:\n    {'additionalProperties': False,\n     'description': 'Schema for a social event',\n     'properties': {'action': {'type': 'string'},\n                    'network': {'type': 'string'},\n                    'target': {'type': 'string'}},\n     'required': ['network', 'action'],\n     'self': {'format': 'jsonschema',\n              'name': 'social_event',\n              'vendor': 'com.mparticle.snowplow',\n              'version': '1-0-0'},\n     'type': 'object'}\n\nOn instance:\n    {'action': 'like',\n     'network': 'Facebook',\n     'target': 'post_123',\n     'extra_property': 'value'}",
      "data": {
        "action": "like",
        "network": "Facebook",
        "target": "post_123",
        "extra_property": "value"
      }
    },
    {
      "description": "llama 70b generated positive",
      "valid": true,
      "data": {
        "action": "share",
        "network": "Facebook",
        "target": "https://example.com"
      }
    }
  ]
}