{
  "description": "sample Snowplow/sp_413_Normalized.json",
  "meta": {
    "full_size": 345,
    "stripped_size": 183,
    "features": [
      "@minmaxLength",
      "additionalProperties"
    ],
    "raw_features": [
      "_boolSchema",
      "maxLength",
      "properties",
      "required",
      "type",
      "type:[]",
      "type:null",
      "type:object",
      "type:string"
    ]
  },
  "schema": {
    "additionalProperties": false,
    "description": "Schema for a single HTTP cookie, as defined in RFC 6265",
    "properties": {
      "name": {
        "maxLength": 4096,
        "type": "string"
      },
      "value": {
        "maxLength": 4096,
        "type": [
          "string",
          "null"
        ]
      }
    },
    "required": [
      "name",
      "value"
    ],
    "self": {
      "format": "jsonschema",
      "name": "http_cookie",
      "vendor": "org.ietf",
      "version": "1-0-0"
    },
    "type": "object"
  },
  "tests": [
    {
      "description": "llama 70b generated valid",
      "valid": true,
      "data": {
        "name": "session_id",
        "value": "1234567890abcdef"
      }
    },
    {
      "description": "llama-70b generated negative; focus on type keyword with an array of types",
      "valid": false,
      "rust_error": "1234567890 is not of types \"null\", \"string\"",
      "python_error": "1234567890 is not of type 'string', 'null'\n\nFailed validating 'type' in schema['properties']['value']:\n    {'maxLength': 4096, 'type': ['string', 'null']}\n\nOn instance['value']:\n    1234567890",
      "data": {
        "name": "session_id",
        "value": 1234567890
      }
    },
    {
      "description": "llama-70b generated negative",
      "valid": false,
      "rust_error": "Additional properties are not allowed ('extra_property' was unexpected)",
      "python_error": "Additional properties are not allowed ('extra_property' was unexpected)\n\nFailed validating 'additionalProperties' in schema:\n    {'additionalProperties': False,\n     'description': 'Schema for a single HTTP cookie, as defined in RFC '\n                    '6265',\n     'properties': {'name': {'maxLength': 4096, 'type': 'string'},\n                    'value': {'maxLength': 4096,\n                              'type': ['string', 'null']}},\n     'required': ['name', 'value'],\n     'self': {'format': 'jsonschema',\n              'name': 'http_cookie',\n              'vendor': 'org.ietf',\n              'version': '1-0-0'},\n     'type': 'object'}\n\nOn instance:\n    {'name': 'session_id',\n     'value': '1234567890abcdef',\n     'extra_property': 'invalid'}",
      "data": {
        "name": "session_id",
        "value": "1234567890abcdef",
        "extra_property": "invalid"
      }
    }
  ]
}