{
  "description": "sample Snowplow/sp_59_Normalized.json",
  "meta": {
    "full_size": 336,
    "stripped_size": 118,
    "features": [
      "additionalProperties",
      "enum"
    ],
    "raw_features": [
      "_boolSchema",
      "properties",
      "type",
      "type:object"
    ]
  },
  "schema": {
    "additionalProperties": false,
    "description": "Schema for a Google Analytics enhanced e-commerce promotion action entity",
    "properties": {
      "promotionAction": {
        "enum": [
          "view",
          "promo_click",
          "null"
        ]
      }
    },
    "self": {
      "format": "jsonschema",
      "name": "promotion_action",
      "vendor": "com.google.analytics.measurement-protocol",
      "version": "1-0-0"
    },
    "type": "object"
  },
  "tests": [
    {
      "description": "llama 70b generated valid",
      "valid": true,
      "data": {
        "promotionAction": "view"
      }
    },
    {
      "description": "llama-70b generated negative",
      "valid": false,
      "rust_error": "\"click\" is not one of [\"view\",\"promo_click\",\"null\"]",
      "python_error": "'click' is not one of ['view', 'promo_click', 'null']\n\nFailed validating 'enum' in schema['properties']['promotionAction']:\n    {'enum': ['view', 'promo_click', 'null']}\n\nOn instance['promotionAction']:\n    'click'",
      "data": {
        "promotionAction": "click"
      }
    },
    {
      "description": "llama-70b generated negative",
      "valid": false,
      "rust_error": "\"VIEW\" is not one of [\"view\",\"promo_click\",\"null\"]",
      "python_error": "'VIEW' is not one of ['view', 'promo_click', 'null']\n\nFailed validating 'enum' in schema['properties']['promotionAction']:\n    {'enum': ['view', 'promo_click', 'null']}\n\nOn instance['promotionAction']:\n    'VIEW'",
      "data": {
        "promotionAction": "VIEW"
      }
    },
    {
      "description": "llama-70b generated negative",
      "valid": false,
      "rust_error": "Additional properties are not allowed ('extraProperty' was unexpected)",
      "python_error": "Additional properties are not allowed ('extraProperty' was unexpected)\n\nFailed validating 'additionalProperties' in schema:\n    {'additionalProperties': False,\n     'description': 'Schema for a Google Analytics enhanced e-commerce '\n                    'promotion action entity',\n     'properties': {'promotionAction': {'enum': ['view',\n                                                 'promo_click',\n                                                 'null']}},\n     'self': {'format': 'jsonschema',\n              'name': 'promotion_action',\n              'vendor': 'com.google.analytics.measurement-protocol',\n              'version': '1-0-0'},\n     'type': 'object'}\n\nOn instance:\n    {'promotionAction': 'view', 'extraProperty': 'extraValue'}",
      "data": {
        "promotionAction": "view",
        "extraProperty": "extraValue"
      }
    }
  ]
}