{
  "description": "sample Snowplow/sp_167_Normalized.json",
  "meta": {
    "full_size": 377,
    "stripped_size": 206,
    "features": [
      "additionalProperties"
    ],
    "raw_features": [
      "_boolSchema",
      "properties",
      "type",
      "type:integer",
      "type:object",
      "type:string"
    ]
  },
  "schema": {
    "additionalProperties": false,
    "description": "Schema for a Pingdom incident being closed event",
    "properties": {
      "check": {
        "type": "string"
      },
      "checkname": {
        "type": "string"
      },
      "description": {
        "type": "string"
      },
      "host": {
        "type": "string"
      },
      "incidentid": {
        "type": "integer"
      }
    },
    "self": {
      "format": "jsonschema",
      "name": "incident_notify_of_close",
      "vendor": "com.pingdom",
      "version": "1-0-0"
    },
    "type": "object"
  },
  "tests": [
    {
      "description": "llama 70b generated valid",
      "valid": true,
      "data": {
        "check": "http",
        "checkname": "My Website",
        "description": "The website is now available",
        "host": "www.example.com",
        "incidentid": 12345
      }
    },
    {
      "description": "llama-70b generated negative",
      "valid": false,
      "rust_error": "Additional properties are not allowed ('extra' was unexpected)",
      "python_error": "Additional properties are not allowed ('extra' was unexpected)\n\nFailed validating 'additionalProperties' in schema:\n    {'additionalProperties': False,\n     'description': 'Schema for a Pingdom incident being closed event',\n     'properties': {'check': {'type': 'string'},\n                    'checkname': {'type': 'string'},\n                    'description': {'type': 'string'},\n                    'host': {'type': 'string'},\n                    'incidentid': {'type': 'integer'}},\n     'self': {'format': 'jsonschema',\n              'name': 'incident_notify_of_close',\n              'vendor': 'com.pingdom',\n              'version': '1-0-0'},\n     'type': 'object'}\n\nOn instance:\n    {'check': 'http',\n     'checkname': 'My Website',\n     'description': 'The website is now available',\n     'host': 'www.example.com',\n     'incidentid': 12345,\n     'extra': 'Invalid property'}",
      "data": {
        "check": "http",
        "checkname": "My Website",
        "description": "The website is now available",
        "host": "www.example.com",
        "incidentid": 12345,
        "extra": "Invalid property"
      }
    },
    {
      "description": "llama 70b generated positive",
      "valid": true,
      "data": {
        "check": "http",
        "checkname": "My Website",
        "description": "The website is now responding correctly",
        "host": "example.com",
        "incidentid": 12345
      }
    }
  ]
}