{
  "description": "sample Snowplow/sp_164_Normalized.json",
  "meta": {
    "full_size": 346,
    "stripped_size": 171,
    "features": [
      "@minmaxLength",
      "additionalProperties"
    ],
    "raw_features": [
      "_boolSchema",
      "maxLength",
      "properties",
      "required",
      "type",
      "type:object",
      "type:string"
    ]
  },
  "schema": {
    "additionalProperties": false,
    "description": "Schema for the Parrable decrypted payload",
    "properties": {
      "browserid": {
        "_format": "uuid",
        "type": "string"
      },
      "deviceid": {
        "maxLength": 36,
        "type": "string"
      }
    },
    "required": [
      "browserid",
      "deviceid"
    ],
    "self": {
      "format": "jsonschema",
      "name": "decrypted_payload",
      "vendor": "com.parrable",
      "version": "1-0-0"
    },
    "type": "object"
  },
  "tests": [
    {
      "description": "llama 70b generated valid",
      "valid": true,
      "data": {
        "browserid": "123e4567-e89b-12d3-a456-426655440000",
        "deviceid": "12345678901234567890123456789012"
      }
    },
    {
      "description": "llama-70b generated negative",
      "valid": false,
      "rust_error": "Additional properties are not allowed ('extraproperty' was unexpected)",
      "python_error": "Additional properties are not allowed ('extraproperty' was unexpected)\n\nFailed validating 'additionalProperties' in schema:\n    {'additionalProperties': False,\n     'description': 'Schema for the Parrable decrypted payload',\n     'properties': {'browserid': {'_format': 'uuid', 'type': 'string'},\n                    'deviceid': {'maxLength': 36, 'type': 'string'}},\n     'required': ['browserid', 'deviceid'],\n     'self': {'format': 'jsonschema',\n              'name': 'decrypted_payload',\n              'vendor': 'com.parrable',\n              'version': '1-0-0'},\n     'type': 'object'}\n\nOn instance:\n    {'browserid': '123e4567-e89b-12d3-a456-426655440000',\n     'deviceid': '123456789012345678901234567890123',\n     'extraproperty': 'value'}",
      "data": {
        "browserid": "123e4567-e89b-12d3-a456-426655440000",
        "deviceid": "123456789012345678901234567890123",
        "extraproperty": "value"
      }
    },
    {
      "description": "llama 70b generated positive",
      "valid": true,
      "data": {
        "browserid": "f47ac10b-58cc-4372-a567-0e02b2c3d479",
        "deviceid": "12345678901234567890123456789012"
      }
    }
  ]
}