{
  "description": "sample Snowplow/sp_318_Normalized.json",
  "meta": {
    "full_size": 348,
    "stripped_size": 175,
    "features": [
      "additionalProperties"
    ],
    "raw_features": [
      "_boolSchema",
      "properties",
      "required",
      "type",
      "type:object",
      "type:string"
    ]
  },
  "schema": {
    "additionalProperties": false,
    "description": "Schema for a social interaction event",
    "properties": {
      "action": {
        "type": "string"
      },
      "network": {
        "type": "string"
      },
      "target": {
        "type": "string"
      }
    },
    "required": [
      "action",
      "network"
    ],
    "self": {
      "format": "jsonschema",
      "name": "social_interaction",
      "vendor": "com.snowplowanalytics.snowplow",
      "version": "1-0-0"
    },
    "type": "object"
  },
  "tests": [
    {
      "description": "llama 70b generated valid",
      "valid": true,
      "data": {
        "action": "like",
        "network": "Facebook",
        "target": "post123"
      }
    },
    {
      "description": "llama-70b generated negative",
      "valid": false,
      "rust_error": "Additional properties are not allowed ('extraProperty' was unexpected)",
      "python_error": "Additional properties are not allowed ('extraProperty' was unexpected)\n\nFailed validating 'additionalProperties' in schema:\n    {'additionalProperties': False,\n     'description': 'Schema for a social interaction event',\n     'properties': {'action': {'type': 'string'},\n                    'network': {'type': 'string'},\n                    'target': {'type': 'string'}},\n     'required': ['action', 'network'],\n     'self': {'format': 'jsonschema',\n              'name': 'social_interaction',\n              'vendor': 'com.snowplowanalytics.snowplow',\n              'version': '1-0-0'},\n     'type': 'object'}\n\nOn instance:\n    {'action': 'like',\n     'network': 'Facebook',\n     'target': 'post123',\n     'extraProperty': 'extraValue'}",
      "data": {
        "action": "like",
        "network": "Facebook",
        "target": "post123",
        "extraProperty": "extraValue"
      }
    },
    {
      "description": "llama-70b generated negative",
      "valid": false,
      "rust_error": "Additional properties are not allowed ('extra_property' was unexpected)",
      "python_error": "Additional properties are not allowed ('extra_property' was unexpected)\n\nFailed validating 'additionalProperties' in schema:\n    {'additionalProperties': False,\n     'description': 'Schema for a social interaction event',\n     'properties': {'action': {'type': 'string'},\n                    'network': {'type': 'string'},\n                    'target': {'type': 'string'}},\n     'required': ['action', 'network'],\n     'self': {'format': 'jsonschema',\n              'name': 'social_interaction',\n              'vendor': 'com.snowplowanalytics.snowplow',\n              'version': '1-0-0'},\n     'type': 'object'}\n\nOn instance:\n    {'action': 'like',\n     'network': 'Facebook',\n     'target': 'post123',\n     'extra_property': 'value'}",
      "data": {
        "action": "like",
        "network": "Facebook",
        "target": "post123",
        "extra_property": "value"
      }
    },
    {
      "description": "llama 70b generated positive",
      "valid": true,
      "data": {
        "action": "like",
        "network": "Facebook",
        "target": "post_123"
      }
    },
    {
      "description": "llama-70b generated negative",
      "valid": false,
      "rust_error": "123 is not of type \"string\"",
      "python_error": "123 is not of type 'string'\n\nFailed validating 'type' in schema['properties']['action']:\n    {'type': 'string'}\n\nOn instance['action']:\n    123",
      "data": {
        "action": 123,
        "network": "Facebook",
        "target": "post_123"
      }
    }
  ]
}