{
  "description": "sample Snowplow/sp_301_Normalized.json",
  "meta": {
    "full_size": 365,
    "stripped_size": 124,
    "features": [
      "additionalProperties"
    ],
    "raw_features": [
      "_boolSchema",
      "properties",
      "required",
      "type",
      "type:object",
      "type:string"
    ]
  },
  "schema": {
    "additionalProperties": false,
    "description": "Context containing ID of parent event (useful for annotating events derived from other events)",
    "properties": {
      "parentEventId": {
        "_format": "uuid",
        "type": "string"
      }
    },
    "required": [
      "parentEventId"
    ],
    "self": {
      "format": "jsonschema",
      "name": "parent_event",
      "vendor": "com.snowplowanalytics.snowplow",
      "version": "1-0-0"
    },
    "type": "object"
  },
  "tests": [
    {
      "description": "llama 70b generated valid",
      "valid": true,
      "data": {
        "parentEventId": "6ba7b810-9dad-11d1-80b4-00c04fd430c8"
      }
    },
    {
      "description": "llama-70b generated negative",
      "valid": false,
      "rust_error": "Additional properties are not allowed ('extraProperty' was unexpected)",
      "python_error": "Additional properties are not allowed ('extraProperty' was unexpected)\n\nFailed validating 'additionalProperties' in schema:\n    {'additionalProperties': False,\n     'description': 'Context containing ID of parent event (useful for '\n                    'annotating events derived from other events)',\n     'properties': {'parentEventId': {'_format': 'uuid', 'type': 'string'}},\n     'required': ['parentEventId'],\n     'self': {'format': 'jsonschema',\n              'name': 'parent_event',\n              'vendor': 'com.snowplowanalytics.snowplow',\n              'version': '1-0-0'},\n     'type': 'object'}\n\nOn instance:\n    {'parentEventId': '6ba7b810-9dad-11d1-80b4-00c04fd430c8',\n     'extraProperty': 'value'}",
      "data": {
        "parentEventId": "6ba7b810-9dad-11d1-80b4-00c04fd430c8",
        "extraProperty": "value"
      }
    }
  ]
}